{"$defs":{"event":{"additionalProperties":false,"properties":{"code":{"pattern":"^[a-z][a-z0-9-]{1,95}$","type":"string"},"kind":{"pattern":"^[a-z][a-z0-9.-]{2,95}$","type":"string"},"partition":{"enum":["private","control"]},"ref":{"pattern":"^[a-z][a-z0-9-]{1,63}$","type":"string"},"seq":{"maximum":63,"minimum":0,"type":"integer"},"state":{"pattern":"^[a-z][a-z0-9-]{1,63}$","type":"string"},"subject":{"pattern":"^[a-z][a-z0-9-]{1,63}$","type":"string"},"text":{"maxLength":4096,"type":"string"}},"required":["seq","kind","partition"],"type":"object"},"expected":{"additionalProperties":false,"properties":{"final_state":{"pattern":"^[a-z][a-z0-9-]{1,63}$","type":"string"},"observable":{"items":{"maxLength":256,"type":"string"},"minItems":1,"type":"array"},"refusal":{"pattern":"^[a-z][a-z0-9-]{1,95}$","type":["string","null"]}},"required":["final_state","observable","refusal"],"type":"object"}},"$id":"catalyst-oracle-suite/1","$schema":"https://json-schema.org/draft/2020-12/schema","additionalProperties":false,"properties":{"bounds":{"additionalProperties":false,"properties":{"max_cases":{"minimum":1,"type":"integer"},"max_events_per_case":{"minimum":1,"type":"integer"},"max_file_bytes":{"minimum":1,"type":"integer"},"max_text_bytes":{"minimum":1,"type":"integer"}},"required":["max_cases","max_events_per_case","max_text_bytes","max_file_bytes"],"type":"object"},"cases":{"items":{"additionalProperties":false,"properties":{"authority_exclusions":{"items":{"maxLength":256,"type":"string"},"minItems":1,"type":"array"},"availability":{"enum":["wired","unavailable"]},"events":{"items":{"$ref":"#/$defs/event"},"maxItems":64,"type":"array"},"expected":{"$ref":"#/$defs/expected"},"family":{"enum":["session","turn","tool","control","runtime","fault","ui"]},"id":{"pattern":"^[a-z][a-z0-9-]{2,63}$","type":"string"},"source_anchors":{"items":{"type":"string"},"minItems":1,"type":"array"}},"required":["id","family","availability","source_anchors","events","expected","authority_exclusions"],"type":"object"},"maxItems":64,"minItems":1,"type":"array"},"privacy_model":{"additionalProperties":false,"properties":{"content-free-control":{"maxLength":512,"minLength":1,"type":"string"},"contract":{"maxLength":512,"minLength":1,"type":"string"},"forbidden":{"maxLength":512,"minLength":1,"type":"string"},"local-pseudonym":{"maxLength":512,"minLength":1,"type":"string"},"private-fixture":{"maxLength":512,"minLength":1,"type":"string"}},"required":["contract","local-pseudonym","private-fixture","content-free-control","forbidden"],"type":"object"},"schema":{"const":"catalyst-oracle-suite/1"},"source_revision":{"pattern":"^[0-9a-f]{40}$","type":"string"}},"required":["schema","source_revision","privacy_model","bounds","cases"],"type":"object"}
