{"bounds":{"max_cases":64,"max_events_per_case":64,"max_file_bytes":262144,"max_text_bytes":4096},"cases":[{"authority_exclusions":["session identity grants no capability"],"availability":"wired","events":[{"kind":"session.create.request","partition":"private","seq":0,"state":"requested","subject":"session-1"},{"kind":"session.created","partition":"control","seq":1,"state":"active","subject":"session-1"}],"expected":{"final_state":"active","observable":["one root session","source and lineage retained"],"refusal":null},"family":"session","id":"session-create","source_anchors":["hermes_state.py:3380-3503"]},{"authority_exclusions":["a claimed session id cannot create runtime authority"],"availability":"unavailable","events":[],"expected":{"final_state":"unavailable","observable":["no replacement thread is synthesized"],"refusal":"resume-unavailable"},"family":"session","id":"session-resume-unavailable","source_anchors":["agent/transports/codex_app_server_session.py:315-387"]},{"authority_exclusions":["parentage grants no role or tool authority"],"availability":"wired","events":[{"kind":"session.branch.request","partition":"private","ref":"session-1","seq":0,"subject":"session-2"},{"kind":"session.branch.created","partition":"control","ref":"session-1","seq":1,"state":"visible","subject":"session-2"}],"expected":{"final_state":"active-child","observable":["branch child remains listable","parent retained"],"refusal":null},"family":"session","id":"session-visible-branch","source_anchors":["hermes_state.py:131-160","hermes_state.py:3380-3503"]},{"authority_exclusions":["summary content does not grant authority"],"availability":"wired","events":[{"kind":"session.compression.request","partition":"private","seq":0,"subject":"session-1"},{"kind":"session.successor.created","partition":"control","ref":"session-1","seq":1,"state":"compression","subject":"session-3"}],"expected":{"final_state":"active-successor","observable":["compression child preserves lineage and inherited workspace origin"],"refusal":null},"family":"session","id":"session-compression-lineage","source_anchors":["hermes_state.py:141-160","hermes_state.py:3388-3401"]},{"authority_exclusions":["assistant text cannot approve tools","runtime terminal is not product acceptance"],"availability":"wired","events":[{"kind":"turn.user.accepted","partition":"private","seq":0,"subject":"turn-1","text":"synthetic user request"},{"kind":"turn.assistant.provisional","partition":"private","seq":1,"subject":"turn-1","text":"synthetic partial"},{"kind":"turn.assistant.final","partition":"private","seq":2,"state":"promoted","subject":"turn-1","text":"synthetic final"},{"kind":"turn.runtime.terminal","partition":"control","seq":3,"state":"completed","subject":"turn-1"}],"expected":{"final_state":"runtime-terminal-candidate","observable":["provisional text is not durable final","one final promotion"],"refusal":null},"family":"turn","id":"turn-stream-final","source_anchors":["run_agent.py:6635-6700","agent/transports/codex_app_server_session.py:470-789"]},{"authority_exclusions":["registry membership is discoverability, not execution authority","arguments cannot widen the snapshot"],"availability":"wired","events":[{"kind":"tool.snapshot.frozen","partition":"control","seq":0,"state":"available","subject":"snapshot-1"},{"kind":"tool.requested","partition":"private","ref":"snapshot-1","seq":1,"state":"pending","subject":"call-1"}],"expected":{"final_state":"awaiting-consent","observable":["request names one frozen definition"],"refusal":null},"family":"tool","id":"tool-snapshot-request","source_anchors":["tools/registry.py:217-370","tools/registry.py:530-620"]},{"authority_exclusions":["prose is not consent","consent for one call does not authorize another"],"availability":"wired","events":[{"kind":"tool.requested","partition":"private","seq":0,"state":"pending","subject":"call-1"},{"code":"user-refused","kind":"tool.consent.receipt","partition":"control","seq":1,"state":"refused","subject":"call-1"}],"expected":{"final_state":"refused","observable":["refused call never executes"],"refusal":null},"family":"tool","id":"tool-approval-refusal","source_anchors":["agent/transports/codex_app_server_session.py:998-1118"]},{"authority_exclusions":["tool result cannot authorize follow-up execution"],"availability":"wired","events":[{"kind":"tool.admission.receipt","partition":"control","seq":0,"state":"admitted","subject":"call-2"},{"kind":"tool.running","partition":"control","seq":1,"state":"running","subject":"call-2"},{"kind":"tool.result.reference","partition":"private","ref":"object-result-1","seq":2,"state":"completed","subject":"call-2"}],"expected":{"final_state":"completed","observable":["execution occurs once","result correlates exact call"],"refusal":null},"family":"tool","id":"tool-execute-result","source_anchors":["tools/registry.py:614-660","run_agent.py:6635-6700"]},{"authority_exclusions":["steer narrows an active turn and creates no new work"],"availability":"wired","events":[{"kind":"control.steer.request","partition":"private","seq":0,"subject":"turn-1","text":"synthetic correction"},{"kind":"control.steer.receipt","partition":"control","seq":1,"state":"accepted","subject":"turn-1"}],"expected":{"final_state":"active-steered","observable":["expected active turn accepts guidance"],"refusal":null},"family":"control","id":"control-steer-exact","source_anchors":["run_agent.py:3031-3059","agent/transports/codex_app_server_session.py:402-427"]},{"authority_exclusions":["request acknowledgement is not terminal proof"],"availability":"wired","events":[{"kind":"control.interrupt.request","partition":"control","seq":0,"subject":"turn-1"},{"kind":"control.interrupt.receipt","partition":"control","seq":1,"state":"requested","subject":"turn-1"}],"expected":{"final_state":"interrupt-pending","observable":["request is idempotent","terminal requires runtime observation"],"refusal":null},"family":"control","id":"control-interrupt-exact","source_anchors":["run_agent.py:2839-2886","agent/transports/codex_app_server_session.py:397-400","agent/transports/codex_app_server_session.py:983-997"]},{"authority_exclusions":["target identity does not grant control"],"availability":"wired","events":[{"kind":"control.steer.request","partition":"private","seq":0,"subject":"turn-stale","text":"synthetic stale guidance"},{"code":"stale-or-foreign-target","kind":"control.refused","partition":"control","seq":1,"state":"refused","subject":"turn-stale"}],"expected":{"final_state":"unchanged","observable":["active turn remains unchanged"],"refusal":"stale-or-foreign-target"},"family":"control","id":"control-stale-foreign-refusal","source_anchors":["agent/transports/codex_app_server_session.py:95-165","agent/transports/codex_app_server_session.py:402-427"]},{"authority_exclusions":["compaction completion is not product acceptance"],"availability":"wired","events":[{"kind":"runtime.compaction.request","partition":"control","seq":0,"subject":"thread-1"},{"kind":"runtime.compaction.started","partition":"control","seq":1,"state":"running","subject":"turn-compact-1"},{"kind":"runtime.compaction.terminal","partition":"control","seq":2,"state":"completed","subject":"turn-compact-1"}],"expected":{"final_state":"compacted","observable":["foreign or pre-start terminal events ignored"],"refusal":null},"family":"runtime","id":"runtime-compaction","source_anchors":["agent/transports/codex_app_server_session.py:791-979"]},{"authority_exclusions":["unavailability cannot fall back to ambient provider"],"availability":"wired","events":[{"kind":"runtime.start.request","partition":"control","seq":0,"subject":"runtime-1"},{"code":"provider-unavailable","kind":"runtime.unavailable","partition":"control","seq":1,"state":"failed","subject":"runtime-1"}],"expected":{"final_state":"unavailable","observable":["error is rendered without synthesized response"],"refusal":"provider-unavailable"},"family":"runtime","id":"runtime-provider-unavailable","source_anchors":["agent/transports/codex_app_server_session.py:470-492"]},{"authority_exclusions":["process exit does not imply product acceptance"],"availability":"unavailable","events":[],"expected":{"final_state":"unavailable","observable":["process teardown exists but durable exact-thread terminal proof is not available"],"refusal":"durable-close-proof-unavailable"},"family":"runtime","id":"runtime-close-proof-unavailable","source_anchors":["agent/transports/codex_app_server.py:185-209","agent/transports/codex_app_server_session.py:375-387"]},{"authority_exclusions":["live queue position is not durable authority"],"availability":"unavailable","events":[],"expected":{"final_state":"unavailable","observable":["notification queue is live-only and no durable cursor is advertised"],"refusal":"durable-replay-unavailable"},"family":"runtime","id":"runtime-replay-unavailable","source_anchors":["agent/transports/codex_app_server.py:143-150","agent/transports/codex_app_server.py:260-279"]},{"authority_exclusions":["valid prefix cannot authorize an oversized event"],"availability":"wired","events":[{"code":"duplicate-gap-oversize","kind":"fault.input","partition":"control","seq":0,"state":"malformed","subject":"turn-1"},{"code":"invalid-event-order-or-bound","kind":"fault.refused","partition":"control","seq":1,"state":"unchanged","subject":"turn-1"}],"expected":{"final_state":"unchanged","observable":["malformed duplicate stale gap and oversize inputs fail closed"],"refusal":"invalid-event-order-or-bound"},"family":"fault","id":"fault-order-bounds","source_anchors":["agent/transports/codex_app_server_session.py:132-165","agent/transports/codex_app_server_session.py:470-789"]},{"authority_exclusions":["later terminal cannot reopen work or approve a pending tool"],"availability":"wired","events":[{"kind":"turn.runtime.terminal","partition":"control","seq":0,"state":"completed","subject":"turn-1"},{"code":"contradictory-terminal","kind":"fault.refused","partition":"control","seq":1,"state":"complete